{
  "apiVersion": "contracts.platform/v1alpha1",
  "kind": "ProviderSwapReceipt",
  "swapId": "storage-filesystem-to-object-store",
  "from": "filesystem-local",
  "to": "object-store-s3",
  "class": "storage",
  "tenantId": "acme",
  "appId": "platform",
  "mode": "planned-migration",
  "at": "2026-03-01T00:00:00Z",
  "status": "cutover",
  "epochBefore": 0,
  "epochAfter": 6,
  "approvalRef": "acme:platform:2026-03-01T00:00:00Z",
  "snapshotDir": "/tmp/dkc059-swap-example",
  "rollbackAvailable": true,
  "oldProviderReadOnly": true,
  "migrationProof": "docs/spec/provider-contracts.md#backendudskiftning",
  "credentials": { "revoked": ["filesystem-local-svc"], "evidenceRetained": true, "active": [] },
  "reconciliation": {
    "apiVersion": "contracts.platform/v1alpha1",
    "kind": "ProviderReconciliation",
    "swapId": "storage-filesystem-to-object-store",
    "from": "filesystem-local",
    "to": "object-store-s3",
    "class": "storage",
    "tenantId": "acme",
    "at": "2026-03-01T00:00:00Z",
    "counts": { "source": 1, "mapped": 1, "created": 1, "failed": 0 },
    "checksums": {
      "algorithm": "sha256",
      "source": "0000000000000000000000000000000000000000000000000000000000000000",
      "target": "0000000000000000000000000000000000000000000000000000000000000000",
      "match": true
    },
    "links": { "preserved": true, "problems": [] },
    "authorization": { "preserved": true, "problems": [] },
    "references": { "preserved": true, "problems": [] },
    "identity": { "preserved": true, "problems": [] },
    "auditProvenance": { "preserved": true, "problems": [] },
    "functionalityLoss": []
  },
  "problems": []
}
